{
  "version": "0.1.0",
  "source_lang": "guppy",
  "qubits": 2,
  "cbits": 2,
  "ops": [
    {"type": "gate",    "name": "H",  "params": [], "qubits": [0]},
    {"type": "gate",    "name": "CX", "params": [], "qubits": [0, 1]},
    {"type": "measure", "qubit": 0,   "cbit": 0},
    {"type": "measure", "qubit": 1,   "cbit": 1}
  ],
  "metadata": {
    "source_lang": "guppy",
    "version": "0.1.0",
    "unsupported": [
      "HUGR graph structure (flattened to sequential ops)",
      "inductive type recursion (not representable in QIR v0.1)"
    ],
    "simulation_note": "Generated by AGENT_02 (NETON) Guppy Python simulation — NOT the real guppylang compiler. No physical QPU execution."
  },
  "resources": {"gate_count": 2, "depth": 3, "t_count": 0, "width": 2}
}
