{
  "version": "0.1.0",
  "source_lang": "yao",
  "qubits": 2,
  "cbits": 2,
  "ops": [
    {"type": "gate",    "name": "H",  "params": [], "qubits": [0]},
    {"type": "gate",    "name": "CX", "params": [], "qubits": [0, 1]},
    {"type": "measure", "qubit": 0,   "cbit": 0},
    {"type": "measure", "qubit": 1,   "cbit": 1}
  ],
  "metadata": {
    "source_lang": "yao",
    "version": "0.1.0",
    "unsupported": [
      "KronBlock parallelism — serialized to sequential in QIR",
      "Differentiable parameters — AD metadata absent in QIR v0.1",
      "Yao.jl ChainBlock nesting — flattened to op sequence"
    ],
    "simulation_note": "Generated by AGENT_03 (PAX-CODER) Yao.jl Julia simulation — NOT a real quantum hardware run. Bell state statevector verified: |Φ⁺⟩ = (|00⟩ + |11⟩)/√2. No physical QPU execution."
  },
  "resources": {"gate_count": 2, "depth": 3, "t_count": 0, "width": 2}
}
